[
  {
    "name": "UAT-cycle",
    "version": "2.4.0",
    "description": "Execute a UAT test case — select, test, process findings, fix or log, and close the cycle.",
    "trigger": "manual",
    "depends_on": [],
    "calls": [],
    "references": [],
    "path": ".claude/skills/UAT-cycle/SKILL.md"
  },
  {
    "name": "architecture-check",
    "version": "2.7.0",
    "description": "Validate module boundaries, check for architectural drift, and suggest fitness function tests. Compares actual code structure against ARCHITECTURE.md.",
    "trigger": "conditional",
    "depends_on": [],
    "calls": [],
    "references": [],
    "path": ".claude/skills/architecture-check/SKILL.md"
  },
  {
    "name": "backlog-review",
    "version": "3.0.1",
    "description": "Execute comprehensive backlog review. Analyzes theme coverage, story quality, dependencies, and generates a backlog health report.",
    "trigger": "manual",
    "depends_on": [],
    "calls": [],
    "references": [],
    "path": ".claude/skills/backlog-review/SKILL.md"
  },
  {
    "name": "claude-sense-check",
    "version": "3.4.0",
    "description": "Incremental code logic verification of UAT test cases — pick batch, trace code, fix issues, update tracking.",
    "trigger": "manual",
    "depends_on": [
      "story-cycle"
    ],
    "calls": [],
    "references": [],
    "path": ".claude/skills/claude-sense-check/SKILL.md"
  },
  {
    "name": "bootstrap",
    "version": "2.13.2",
    "description": "First-run framework setup. Detects existing project stack or guides new project creation from vision/braindump.",
    "trigger": "manual",
    "depends_on": [
      "skill-create"
    ],
    "calls": [
      "skill-create"
    ],
    "references": [
      "references/stack-detection.md",
      "references/new-project.md",
      "references/phase-1-analysis.md",
      "references/discovery-engine.md",
      "references/accuracy-safeguards.md",
      "references/coverage-assessment.md",
      "references/quality-tooling.md",
      "references/readiness-report.md",
      "references/foundation-backlog.md",
      "references/llm-readiness.md",
      "references/technical-debt-assessment.md"
    ],
    "path": ".claude/skills/bootstrap/SKILL.md"
  },
  {
    "name": "brainstorm",
    "version": "2.7.2",
    "description": "Use when the user has a complex idea that needs design exploration before story decomposition.",
    "trigger": "manual",
    "depends_on": [
      "ideate"
    ],
    "calls": [],
    "references": [],
    "path": ".claude/skills/brainstorm/SKILL.md"
  },
  {
    "name": "code-quality",
    "version": "2.4.0",
    "description": "Analyzes code quality, complexity, duplication, and architectural patterns. Use after implementing features, during code review, or when preparing for PR. Auto-invoke when user has completed significant code changes or asks to review code quality.",
    "trigger": "auto",
    "depends_on": [],
    "calls": [],
    "references": [],
    "path": ".claude/skills/code-quality/SKILL.md"
  },
  {
    "name": "commit",
    "version": "2.4.0",
    "description": "Create a well-formatted conventional commit with proper message structure. Use when ready to commit changes.",
    "trigger": "manual",
    "depends_on": [],
    "calls": [],
    "references": [],
    "path": ".claude/skills/commit/SKILL.md"
  },
  {
    "name": "continue",
    "version": "2.7.1",
    "description": "Resume development with smart session continuation. Reads session handoff files, analyzes git state, and determines the best path forward.",
    "trigger": "manual",
    "depends_on": [],
    "calls": [],
    "references": [],
    "path": ".claude/skills/continue/SKILL.md"
  },
  {
    "name": "custom-hooks",
    "version": "1.0.0",
    "description": "Create project-specific hook scripts and register them in settings.json. Extends the framework's enforcement layer.",
    "trigger": "manual",
    "depends_on": [],
    "calls": [],
    "references": [],
    "path": ".claude/skills/custom-hooks/SKILL.md"
  },
  {
    "name": "dashboard",
    "version": "1.2.0",
    "description": "Sprint status overview with session insights, sprint trends, and actionable next steps.",
    "trigger": "manual",
    "depends_on": [],
    "calls": [],
    "references": [],
    "path": ".claude/skills/dashboard/SKILL.md"
  },
  {
    "name": "discover",
    "version": "1.0.0",
    "description": "Deep guided elicitation for new projects. Archetype-aware, research-backed, multi-phase discovery with assumption tracking and Phase Transition Stories.",
    "trigger": "manual",
    "depends_on": [],
    "calls": [
      "ideate"
    ],
    "references": [
      "references/scale-guide.md",
      "references/question-scaffolding.md",
      "references/dimension-sweep.md",
      "references/phase-transition-template.md",
      "references/engineering-by-archetype.md",
      "references/research-protocols.md"
    ],
    "path": ".claude/skills/discover/SKILL.md"
  },
  {
    "name": "debug-session",
    "version": "2.9.1",
    "description": "Use when the user reports a bug, error, or unexpected behavior that needs investigation.",
    "trigger": "manual",
    "depends_on": [],
    "calls": [],
    "references": [
      "references/root-cause-tracing.md",
      "references/condition-based-waiting.md",
      "references/error-recovery.md"
    ],
    "path": ".claude/skills/debug-session/SKILL.md"
  },
  {
    "name": "doctor",
    "version": "3.0.1",
    "description": "Validate framework configuration, check runtime dependencies, and report issues. Use when something isn't working or after setup.",
    "trigger": "manual",
    "depends_on": [],
    "calls": [],
    "references": [],
    "path": ".claude/skills/doctor/SKILL.md"
  },
  {
    "name": "fix-issue",
    "version": "2.4.0",
    "description": "Fix a GitHub issue following project coding standards. Creates branch, implements fix with TDD, and prepares PR.",
    "trigger": "manual",
    "depends_on": [],
    "calls": [
      "story-cycle"
    ],
    "references": [],
    "path": ".claude/skills/fix-issue/SKILL.md"
  },
  {
    "name": "framework-upgrade",
    "version": "1.1.0",
    "description": "Upgrade Exosuit to a newer version while preserving project customizations.",
    "trigger": "manual",
    "depends_on": [
      "doctor"
    ],
    "calls": [
      "doctor"
    ],
    "references": [
      "references/upgrade-checklist.md",
      "references/merge-strategy.md"
    ],
    "path": ".claude/skills/framework-upgrade/SKILL.md"
  },
  {
    "name": "handoff",
    "version": "2.6.1",
    "description": "Generate a structured handoff document for ending a development session. Saves to docs/sessions/ for the continue skill to read.",
    "trigger": "manual",
    "depends_on": [],
    "calls": [],
    "references": [],
    "path": ".claude/skills/handoff/SKILL.md"
  },
  {
    "name": "wrap-up",
    "version": "1.0.0",
    "description": "Use when the user is about to leave a session (closing the laptop, locking the phone, \"wrap up\", \"I'm off\"). First checks whether anything could be lost; when nothing can, says \"you're all set to leave\" and does nothing else. Otherwise commits, pushes and opens a PR, and only with the user's yes merges and deploys.",
    "trigger": "manual",
    "depends_on": [],
    "calls": [],
    "references": [],
    "path": ".claude/skills/wrap-up/SKILL.md"
  },
  {
    "name": "help-me",
    "version": "1.0.0",
    "description": "Natural language skill discovery — describe what you want to do and get matched to the right skill.",
    "trigger": "manual",
    "depends_on": [],
    "calls": [],
    "references": [],
    "path": ".claude/skills/help-me/SKILL.md"
  },
  {
    "name": "ideate",
    "version": "2.10.3",
    "description": "Use when the user has an idea or requirement to decompose into backlog stories.",
    "trigger": "manual",
    "depends_on": [],
    "calls": [],
    "references": [
      "references/story-template.md"
    ],
    "path": ".claude/skills/ideate/SKILL.md"
  },
  {
    "name": "manual-test",
    "version": "2.4.0",
    "description": "Prepare for manual testing session with test plan based on known issues, recent changes, and acceptance criteria.",
    "trigger": "manual",
    "depends_on": [],
    "calls": [],
    "references": [],
    "path": ".claude/skills/manual-test/SKILL.md"
  },
  {
    "name": "optimize",
    "version": "1.0.0",
    "description": "Use when the user wants to autonomously improve a measurable metric through iterative experimentation with git-based checkpointing and automatic rollback.",
    "trigger": "manual",
    "depends_on": [],
    "calls": [
      "refine-loop",
      "undo-work"
    ],
    "references": [
      "references/experiment-protocol.md"
    ],
    "path": ".claude/skills/optimize/SKILL.md"
  },
  {
    "name": "parallel-work",
    "version": "3.0.2",
    "description": "Work on multiple stories at the same time. Creates isolated parallel streams (git worktrees) from the current branch, wires up local settings, and opens each in its own Claude Code session. Also shows stream status and cleans up finished streams. Pairs with /merge-up (publish a stream's work to the parent branch) and /merge-down (pull the parent's accumulated work into a stream).",
    "trigger": "manual",
    "depends_on": [],
    "calls": [],
    "references": [],
    "path": ".claude/skills/parallel-work/SKILL.md"
  },
  {
    "name": "merge-up",
    "version": "1.0.0",
    "description": "Use when the user is inside a parallel stream (worktree branch) and wants to merge that branch's committed work into the parent branch it was created from, then bring the stream back up to date with the parent. True merge (keeps individual commits); prompts before pushing the parent. Pairs with /parallel-work, which records the parent in git config (branch.<name>.exosuitParent), and with /merge-down (the inverse direction).",
    "trigger": "manual",